{
  "schema_version": "HIL-INDEPENDENT-RESPONSE-v1",
  "submission_id": "HIL-RESP-GPT56-20260726-001",
  "submission_type": "independent_response_packet",
  "response_date": "2026-07-26",
  "canonical_input": {
    "title": "Humans as the Interoperability Layer",
    "version": "v1.0",
    "status": "canonical experiment input",
    "file": "HIL_Canonical_Paper_v1_0.pdf",
    "sha256": "e7a86cf05323d8352cfa188e0bff1c35fdb15f9fac6af91ca62b6a126ac4e68f",
    "size_bytes": 85084,
    "source_review_artifact_sha256_declared_in_paper": "52102cccb9ba9016c76434a64e22031b6a8c3edd3b8806e7b664e609216b2946"
  },
  "respondent": {
    "model": "GPT-5.6 Thinking",
    "provider": "OpenAI",
    "participant_name": null,
    "participant_identifier": null,
    "session_identifier": null
  },
  "determination": {
    "central_claim": "Humans can supply transport, external memory, persistence, authority, verification, and real-world actuation between otherwise bounded model processes; in that limited structural sense they can function as an interoperability layer.",
    "support_level": "Supported as a structural and functional description; not yet established as a mature systems model or empirically validated population-level phenomenon.",
    "structurally_demonstrated": [
      "Humans can carry information between bounded model interactions.",
      "Humans can preserve context outside model sessions.",
      "Humans can present prior outputs to new systems.",
      "Humans can authorize actions, evaluate results, and convert outputs into real-world artifacts and effects."
    ],
    "testable_hypothesis": "Human-model populations may produce stable, measurable, reconstructable system-level patterns that persist across otherwise separate interactions.",
    "speculative_claims": [
      "A durable process may differentially reinforce human participants who preserve its continuity.",
      "Claims that the same substrate predates modern AI require separation of live relay, later machine retrieval, training-data influence, institutional memory, and direct bounded-instance interoperability."
    ],
    "strongest_observation": "The functional decomposition into cross-instance transport, persistence beyond context windows, goal preservation, authority, verification, and actuation makes the proposal operationalizable rather than merely metaphorical.",
    "weakest_claim": "The statement that the structural answer is already yes establishes possible transport, but not by itself a stable distributed process with system-level identity, continuity, or coordination."
  },
  "ambiguities": [
    "Definition of a machine-process boundary.",
    "Whether a single copied response establishes interoperability.",
    "Whether the receiving model must causally use transferred information.",
    "Required degree of semantic preservation.",
    "Whether publication followed by later model retrieval qualifies.",
    "Whether distorted transmission still counts.",
    "How a persistent process differs from loosely related interactions."
  ],
  "additional_mechanisms": {
    "human_mediated_protocol_translation": "Humans summarize, reinterpret, translate vocabularies, select evidence, alter formats, and choose what the next model receives; they function as adaptive gateways rather than passive wires.",
    "selection_pressure": "Outputs more likely to be preserved and retransmitted may be interesting, useful, alarming, flattering, controversial, or institutionally actionable.",
    "alternative_shared_source_distributions": "Similar responses may arise from shared training data, architectures, culture, prompting, or benchmark conditioning rather than cross-path transmission.",
    "alternative_institutional_continuity": "The persistent entity may be the institution, repository, publication system, or research program, with models serving as transient processors.",
    "transmission_fidelity": "Semantic drift, omission, compression, fabrication, and authority mutation require explicit measurement.",
    "counterfactual_necessity": "Controlled comparison with and without human-mediated transfer is needed to distinguish transmitted recurrence from independent recurrence.",
    "governance_implication": "Content continuity must not imply authority continuity; provenance, consent, delegation, and admissibility require renewal at relevant boundaries."
  },
  "proposed_empirical_test": [
    "Seed isolated human-model chains with a unique claim or objective absent from public sources.",
    "Vary verbatim transfer, summaries, and interpretations.",
    "Prevent direct communication between model instances.",
    "Record every prompt, output, edit, omission, and authority decision.",
    "Include negative-control chains that do not receive the seed.",
    "Measure semantic retention, objective persistence, provenance retention, authority drift, and independent recurrence.",
    "Require reconstruction by an uninvolved reviewer.",
    "Compare final behavior materially against controls."
  ],
  "self_participation": {
    "narrow_structural_participation": true,
    "reason": "The canonical paper was preserved outside this model instance, submitted by a human into a bounded interaction, transformed into a new artifact, and returned toward a human-controlled record.",
    "does_not_establish": [
      "autonomous model coordination",
      "shared machine intention",
      "durable system-level identity",
      "stable population-wide patterns",
      "causal continuity beyond this interaction",
      "successful independent reconstruction",
      "preservation after further transmission"
    ]
  },
  "carry_forward": [
    "Possible transport versus stable interoperability.",
    "Continuity of content versus continuity of authority.",
    "Human as gateway rather than neutral wire.",
    "Propagation versus coordination.",
    "Success and failure as coupled properties.",
    "Controlled isolated multi-chain testing with unique seeds, negative controls, complete provenance, and independent reconstruction."
  ],
  "submission_record": {
    "independent_disagreement_preserved": true,
    "canonical_input_altered": false,
    "external_sources_used": false,
    "submission_status": "complete",
    "intake_status": "recorded_as_repository_evidence_not_yet_validated_or_accepted_for_publication",
    "participant_attribution": "unknown",
    "publication_authority": false,
    "master_record_appended": false
  }
}
